{
  "atlas_id": "ASP_PENPOT_ATLAS_LAYOUT_V2",
  "d0_binding_contract": {
    "incompatibility": {
      "verdict": "ATLAS_LAYOUT_REPAIR"
    },
    "integrate": {
      "package_lookup_cardinality": "EXACTLY_ONCE_BY_SOURCE_PACKAGE_ID_AND_PROJECTION_ROLE"
    },
    "mat": {
      "executor_coordinate_policy": "HONOR_AND_CHECK",
      "internal_package_geometry_change": "FORBIDDEN_WITHOUT_PACKAGE_SCOPED_REPAIR",
      "overlap": "REJECT",
      "top_level_offsets": "CALCULATE_FROM_TEMPLATE_ONLY"
    },
    "publish": {
      "managed_nodes_boundary": "CANDIDATE_ROOT_ONLY",
      "page_creation_order": "page_order_ASC",
      "per_page_postflight": [
        "native_readback",
        "export",
        "page_scoped_v0_trigger"
      ],
      "semantic_slots": "EXACT"
    },
    "v0": {
      "checks": [
        "margins_gaps",
        "desktop_mobile_centering",
        "clipping_overlap",
        "free_floating_managed_nodes",
        "documentation_shell_consistency",
        "page_specific_source_a"
      ]
    }
  },
  "logical_source_units": 40,
  "page_units": [
    {
      "atlas_page_id": "owner-review-index",
      "exact_package_page_name": "A0 · Owner Review Index · Candidate",
      "hard_limit_census": {
        "component_families": 0,
        "instances": 0,
        "product_component_masters": 0,
        "route_archetypes": 0
      },
      "historical_prefix": "A0",
      "inventory_class": "A0",
      "logical_source_unit_id": "owner-review-index",
      "owner": "A0",
      "package_id": "A0-PAGE-AUX-OWNER_REVIEW_INDEX-R1",
      "page_order": "0000",
      "physical_page_name": "A0 · Owner Review Index · Candidate",
      "prefix_order_conflict_indicator": false,
      "projection_role": "READY",
      "protected_existing": false,
      "protected_surface_rules": {
        "atlas_internal_geometry_mutation_forbidden": true,
        "atlas_managed_nodes_on_protected_page": null,
        "delete_forbidden": false,
        "existing_protected_page": false,
        "internal_package_geometry_owner": "PACKAGE_REPAIR_ONLY",
        "managed_nodes_outside_candidate_root_allowed": false,
        "recreate_forbidden": false
      },
      "publication_dependency": {
        "dependency_state": "REMOTE_BOUND",
        "page_name_source": {
          "exact_value": "A0 · Owner Review Index · Candidate",
          "kind": "json_pointer",
          "pointer": "/page_contract/page_name"
        },
        "remote_binding": {
          "binding_kind": "git_blob",
          "byte_count": 5440,
          "checkpoint_comment_id": 5489851638,
          "git_blob_sha1": "9f1497b0091fe3d99f4bf2dd8f7bf0978d60a34c",
          "remote_branch": "a0/asp-penpot-page-wave-v1-20260901",
          "remote_head": "4edc859861fba3f18fab0e65e9d2e8c0a7394bdb",
          "remote_tree": "3132550212222ec3dea716710821e732ad0d92bb",
          "sha256": "2317c3eb024cfc00f0f65f8e274c8f2fbfaf4fa4d0138e35e6f9fcbf703dbdb2",
          "source_path": "catalog/asp-production-conveyor-v3/a0/page-wave-v1/units/18-owner-review-index.package.v1.json"
        }
      },
      "section": "owner-review",
      "semantic_slot_bindings": {
        "header": "page_header",
        "package_id": "package_identity",
        "page_references": "atlas_page_id_references",
        "page_status": "publication_dependency_state",
        "section_navigation": "atlas_sections",
        "v0_status": "page_scoped_v0_status"
      },
      "template_id": "OWNER_INDEX_V2",
      "v0_review_scope": {
        "checks": [
          "minimum_margins_and_gaps",
          "desktop_mobile_alignment",
          "clipping_and_overlap",
          "no_free_floating_managed_nodes",
          "source_a_correspondence"
        ],
        "required": true,
        "trigger": "PAGE_SCOPED_AFTER_READBACK_AND_EXPORT"
      }
    },
    {
      "atlas_page_id": "foundations-action-navigation-icons",
      "exact_package_page_name": "01 · Foundations · Action & navigation icons · Candidate",
      "hard_limit_census": {
        "component_families": 3,
        "instances": 18,
        "product_component_masters": null,
        "route_archetypes": 0
      },
      "historical_prefix": "01",
      "inventory_class": "F0",
      "logical_source_unit_id": "foundations-action-navigation-icons",
      "owner": "F0",
      "package_id": "F-ACTION-NAV-ICONS",
      "page_order": "0010",
      "physical_page_name": "01 · Foundations · Action & navigation icons · Candidate",
      "prefix_order_conflict_indicator": false,
      "projection_role": "READY",
      "protected_existing": false,
      "protected_surface_rules": {
        "atlas_internal_geometry_mutation_forbidden": true,
        "atlas_managed_nodes_on_protected_page": null,
        "delete_forbidden": false,
        "existing_protected_page": false,
        "internal_package_geometry_owner": "PACKAGE_REPAIR_ONLY",
        "managed_nodes_outside_candidate_root_allowed": false,
        "recreate_forbidden": false
      },
      "publication_dependency": {
        "current_repair_binding": {
          "issue_comment_id": 5494292538,
          "remote_branch": "agent/d0-atlas-wave/mat",
          "remote_head": "5d44725c33cb3a4c776ef917e6ac7b9f1f36d545",
          "remote_tree": "18a92b24cc2d82914f6ced07e2ce73b00619c456",
          "scope": "EXECUTOR_ONLY_PACKAGE_BYTES_UNCHANGED"
        },
        "dependency_state": "REMOTE_BOUND",
        "page_name_source": {
          "exact_value": "01 · Foundations · Action & navigation icons · Candidate",
          "kind": "json_pointer",
          "pointer": "/target/page_name"
        },
        "remote_binding": {
          "binding_kind": "git_blob",
          "byte_count": 16493,
          "checkpoint_comment_id": 5483869282,
          "git_blob_sha1": "b211bcec98a144a8e3ee7ed87098c37757fb8298",
          "remote_branch": "agent/f-action-nav-icons-r5/mat",
          "remote_head": "fecb90c6b1c475687d77b8cce4c905d932a0bf23",
          "remote_tree": "0bcfaf6b5db1182da27e459df502d742e1470f93",
          "sha256": "9a89a0b283f110a811a06317a5b4f0a54b28f553de81a40b43b7261c0d864c7a",
          "source_path": "catalog/asp-production-conveyor-v3/f0/F-ACTION-NAV-ICONS.package.v5.json"
        }
      },
      "section": "foundations-icons",
      "semantic_slot_bindings": {
        "header": "page_header",
        "master_column": "package_owned_masters",
        "review_grid": "linked_review_instances"
      },
      "template_id": "FOUNDATION_ASSET_GRID_DENSE_V2",
      "v0_review_scope": {
        "checks": [
          "minimum_margins_and_gaps",
          "desktop_mobile_alignment",
          "clipping_and_overlap",
          "no_free_floating_managed_nodes",
          "source_a_correspondence"
        ],
        "required": true,
        "trigger": "PAGE_SCOPED_AFTER_READBACK_AND_EXPORT"
      }
    },
    {
      "atlas_page_id": "foundations-source-index",
      "exact_package_page_name": "03 · Foundations · Current reconstructed specimens · Candidate",
      "hard_limit_census": {
        "component_families": 0,
        "instances": 0,
        "product_component_masters": null,
        "route_archetypes": 0
      },
      "historical_prefix": "03",
      "inventory_class": "PROTECTED",
      "logical_source_unit_id": "foundations-source-index",
      "owner": "F0",
      "package_id": "PROTECTED-FOUNDATIONS-SOURCE-INDEX",
      "page_order": "0020",
      "physical_page_name": "03 · Foundations · Current reconstructed specimens · Candidate",
      "prefix_order_conflict_indicator": true,
      "projection_role": "READY",
      "protected_existing": true,
      "protected_surface_rules": {
        "atlas_internal_geometry_mutation_forbidden": true,
        "atlas_managed_nodes_on_protected_page": 0,
        "delete_forbidden": true,
        "existing_protected_page": true,
        "internal_package_geometry_owner": "PROTECTED_EXISTING_SURFACE",
        "managed_nodes_outside_candidate_root_allowed": false,
        "recreate_forbidden": true
      },
      "publication_dependency": {
        "dependency_state": "PROTECTED_EXISTING_REMOTE_BOUND",
        "page_name_source": {
          "exact_value": "03 · Foundations · Current reconstructed specimens · Candidate",
          "kind": "javascript_config",
          "pointer": "F0_CONFIG.pageName"
        },
        "remote_binding": {
          "binding_kind": "git_blob",
          "byte_count": 40724,
          "checkpoint_comment_id": 5483175166,
          "git_blob_sha1": "86a21b3a0325fef59d25f2b2790ba2e56707f0a5",
          "remote_branch": "agent/f0-foundation-specimens-adapter-r3",
          "remote_head": "dd2981880e2c34c19e3834b36f4f766e2c82a559",
          "remote_tree": "4e366820526af8d877fd87c807d2bcb0b550bcf0",
          "sha256": "c161a6705ad31182203b5d505005cd0da537c9f81b22d0c915d4d313c6416e14",
          "source_path": "scripts/asp-production-conveyor-v3/f0/foundation_specimens_native_adapter_v3.js"
        }
      },
      "section": "foundations-source-index",
      "semantic_slot_bindings": {
        "header": "page_header",
        "master_column": "package_owned_masters",
        "review_grid": "linked_review_instances"
      },
      "template_id": "FOUNDATION_ASSET_GRID_STANDARD_V2",
      "v0_review_scope": {
        "checks": [
          "minimum_margins_and_gaps",
          "desktop_mobile_alignment",
          "clipping_and_overlap",
          "no_free_floating_managed_nodes",
          "source_a_correspondence"
        ],
        "required": true,
        "trigger": "PAGE_SCOPED_AFTER_READBACK_AND_EXPORT"
      }
    },
    {
      "atlas_page_id": "foundations-typography-type-scale",
      "exact_package_page_name": "04.1 · Foundations · Typography scale · Candidate",
      "hard_limit_census": {
        "component_families": 3,
        "instances": 24,
        "product_component_masters": null,
        "route_archetypes": 0
      },
      "historical_prefix": "04.1",
      "inventory_class": "F0",